{
  "procedure_id": "1.000889",
  "title": "Cấp đổi thẻ căn cước (thực hiện tại cấp trung ương)",
  "variant_of": null,
  "field": "Cấp, quản lý căn cước",
  "level": "trung ương",
  "jurisdiction": "toàn quốc",
  "receiving_agency": "Cục cảnh sát quản lý hành chính về trật tự, xã hội",
  "channels": [
    "Trực tiếp"
  ],
  "required_documents": [
    {
      "item": "Giấy tờ, tài liệu có giá trị pháp lý chứng minh là người đại diện hợp pháp của người dưới 14 tuổi",
      "quantity": 1,
      "quantity_text": "Bản chính: 1; Bản sao: 0",
      "mandatory": null,
      "note": null
    },
    {
      "item": "Phiếu thu nhận thông tin căn cước (Mẫu CC01 ban hành kèm theo Thông tư số 17/2024/TT-BCA của Bộ Công an)",
      "quantity": 1,
      "quantity_text": "Bản chính: 1; Bản sao: 0",
      "mandatory": null,
      "note": "Nhóm hồ sơ: Phiếu được tạo lập khi trích xuất thông tin của công dân trong Cơ sở dữ liệu quốc gia về dân cư và in trong quá trình thu nhận hồ sơ căn cước để công dân kiểm tra và ký xác nhận. | Mẫu: Mẫu CC01 Phiếu thu nhận thông tin căn cước.doc"
    }
  ],
  "steps": [
    "- Bước 1: Công dân đến cơ quan quản lý căn cước của Bộ Công an đề nghị cấp đổi thẻ căn cước, cung cấp thông tin gồm họ, chữ đệm và tên khai sinh, số định danh cá nhân, nơi cư trú để người tiếp nhận kiểm tra đối chiếu thông tin trong Cơ sở dữ liệu quốc gia về dân cư;",
    "- Bước 2: Cán bộ thu nhận thông tin công dân tìm kiếm thông tin trong Cơ sở dữ liệu quốc gia về dân cư để lập hồ sơ đổi thẻ căn cước.\n+ Trường hợp thông tin công dân không có sự thay đổi, điều chỉnh thì sử dụng thông tin của công dân trong cơ sở dữ liệu quốc gia về dân cư để lập hồ sơ cấp đổi thẻ căn cước.\n+ Trường hợp thông tin công dân có sự thay đổi, điều chỉnh thì Cán bộ thu nhận hướng dẫn công dân thực hiện thủ tục điều chỉnh thông tin trong Cơ sở dữ liệu quốc gia về dân cư trước khi thực hiện thủ tục cấp thẻ căn cước\nTrường hợp công dân không đủ điều kiện cấp đổi thẻ căn cước thì từ chối tiếp nhận và nêu rõ lý do, thông báo về việc từ chối giải quyết thủ tục về căn cước (mẫu CC03 ban hành kèm theo Thông tư số 17/2024/TT-BCA ngày 15/5/2024 của Bộ Công an).",
    "- Bước 3: Tiến hành thu nhận vân tay, chụp ảnh khuôn mặt, thu nhận ảnh mống mắt của công dân từ đủ 06 tuổi trở lên.",
    "- Bước 4: In Phiếu thu nhận thông tin căn cước chuyển cho công dân hoặc người đại diện của người dưới 14 tuổi kiểm tra, ký xác nhận;",
    "- Bước 5: Thu thẻ căn cước cũ, thu lệ phí (nếu có) và cấp giấy hẹn trả kết quả giải quyết thủ tục về căn cước cho công dân (mẫu CC02 ban hành kèm theo Thông tư số 17/2024/TT-BCA ngày 15/5/2024 của Bộ Công an).",
    "- Bước 6: Nhận kết quả trực tiếp tại cơ quan quản lý căn cước của Bộ Công an hoặc trả qua dịch vụ bưu chính đến địa chỉ theo yêu cầu."
  ],
  "fees": [
    {
      "value": "miễn lệ phí",
      "condition": "Lệ phí: trang ghi \"Không\"",
      "jurisdiction": "toàn quốc"
    }
  ],
  "processing_time": "Trực tiếp: 07 Ngày làm việc",
  "legal_basis": [
    "Luật Căn cước Số: 26/2023/QH15",
    "Thông tư quy định chi tiết một số điều và biện pháp thi hành Luật Căn cước Số: 17/2024/TT-BCA",
    "Nghị định của Chính phủ: Quy định chi tiết một số điều và biện pháp thi hành Luật Căn cước Số: 70/2024/NĐ-CP",
    "Thông tư 16/2024/TT-BCA quy định về mẫu thẻ căn cước, mẫu giấy chứng nhận căn cước Số: 16/2024/TT-BCA",
    "Thông tư quy định quy định về quy trình cấp, cấp đổi, cấp lại thẻ căn cước, giấy chứng nhận căn cước Số: 18/2024/TT-BCA"
  ],
  "conditions": "Không.",
  "raw_text": "Mã thủ tục:\n1.000889\n\nLĩnh vực:\nCấp, quản lý căn cước\n\nCơ quan thực hiện:\nCục cảnh sát quản lý hành chính về trật tự, xã hội\n\nMức độ cung cấp dịch vụ công trực tuyến:\nDịch vụ công trực tuyến một phần\n\nCách thức thực hiện:\nTrực tiếp\n\nTrình tự thực hiện:\n- Bước 1: Công dân đến cơ quan quản lý căn cước của Bộ Công an đề nghị cấp đổi thẻ căn cước, cung cấp thông tin gồm họ, chữ đệm và tên khai sinh, số định danh cá nhân, nơi cư trú để người tiếp nhận kiểm tra đối chiếu thông tin trong Cơ sở dữ liệu quốc gia về dân cư;\n- Bước 2: Cán bộ thu nhận thông tin công dân tìm kiếm thông tin trong Cơ sở dữ liệu quốc gia về dân cư để lập hồ sơ đổi thẻ căn cước.\n+ Trường hợp thông tin công dân không có sự thay đổi, điều chỉnh thì sử dụng thông tin của công dân trong cơ sở dữ liệu quốc gia về dân cư để lập hồ sơ cấp đổi thẻ căn cước.\n+ Trường hợp thông tin công dân có sự thay đổi, điều chỉnh thì Cán bộ thu nhận hướng dẫn công dân thực hiện thủ tục điều chỉnh thông tin trong Cơ sở dữ liệu quốc gia về dân cư trước khi thực hiện thủ tục cấp thẻ căn cước\nTrường hợp công dân không đủ điều kiện cấp đổi thẻ căn cước thì từ chối tiếp nhận và nêu rõ lý do, thông báo về việc từ chối giải quyết thủ tục về căn cước (mẫu CC03 ban hành kèm theo Thông tư số 17/2024/TT-BCA ngày 15/5/2024 của Bộ Công an).\n- Bước 3: Tiến hành thu nhận vân tay, chụp ảnh khuôn mặt, thu nhận ảnh mống mắt của công dân từ đủ 06 tuổi trở lên.\n- Bước 4: In Phiếu thu nhận thông tin căn cước chuyển cho công dân hoặc người đại diện của người dưới 14 tuổi kiểm tra, ký xác nhận;\n- Bước 5: Thu thẻ căn cước cũ, thu lệ phí (nếu có) và cấp giấy hẹn trả kết quả giải quyết thủ tục về căn cước cho công dân (mẫu CC02 ban hành kèm theo Thông tư số 17/2024/TT-BCA ngày 15/5/2024 của Bộ Công an).\n- Bước 6: Nhận kết quả trực tiếp tại cơ quan quản lý căn cước của Bộ Công an hoặc trả qua dịch vụ bưu chính đến địa chỉ theo yêu cầu.\n\nThời hạn giải quyết:\nTrực tiếp\n07 Ngày làm việc\n- Trực tiếp tại cơ quan quản lý căn cước của Bộ Công an (Trung tâm dữ liệu quốc gia về dân cư, Cục Cảnh sát quản lý hành chính về trật tự xã hội, Bộ Công an).\n- Cấp lưu động tại tại xã, phường, thị trấn, cơ quan, đơn vị hoặc tại chỗ ở của công dân trong trường hợp cần thiết.\n- Thời gian tiếp nhận hồ sơ: Giờ hành chính các ngày làm việc từ thứ 2 đến thứ 6 hàng tuần (trừ các ngày nghỉ lễ, tết theo quy định của pháp luật).\n\nPhí:\nTrực tiếp\n07 Ngày làm việcChưa quy định.\n\nLệ Phí:\nKhông\n\nThành phần hồ sơ:\nTên giấy tờ\nMẫu đơn, tờ khai\nSố lượng\nGiấy tờ, tài liệu có giá trị pháp lý chứng minh là người đại diện hợp pháp của người dưới 14 tuổi\nBản chính: 1\nBản sao: 0\nPhiếu được tạo lập khi trích xuất thông tin của công dân trong Cơ sở dữ liệu quốc gia về dân cư và in trong quá trình thu nhận hồ sơ căn cước để công dân kiểm tra và ký xác nhận.\nTên giấy tờ\nMẫu đơn, tờ khai\nSố lượng\nPhiếu thu nhận thông tin căn cước (Mẫu CC01 ban hành kèm theo Thông tư số 17/2024/TT-BCA của Bộ Công an)\nMẫu CC01 Phiếu thu nhận thông tin căn cước.doc\nBản chính: 1\nBản sao: 0\n\nYêu cầu - điều kiện:\nKhông.\n\nCăn cứ pháp lý:\nLuật Căn cước\nSố: 26/2023/QH15\nThông tư quy định chi tiết một số điều và biện pháp thi hành Luật Căn cước\nSố: 17/2024/TT-BCA\nNghị định của Chính phủ: Quy định chi tiết một số điều và biện pháp thi hành Luật Căn cước\nSố: 70/2024/NĐ-CP\nThông tư 16/2024/TT-BCA quy định về mẫu thẻ căn cước, mẫu giấy chứng nhận căn cước\nSố: 16/2024/TT-BCA\nThông tư quy định quy định về quy trình cấp, cấp đổi, cấp lại thẻ căn cước, giấy chứng nhận căn cước\nSố: 18/2024/TT-BCA\n\nBiểu mẫu:\nFile mẫu:\nPhiếu thu nhận thông tin căn cước công dân (ký hiệu là CC02)\nTải về\nTờ khai Căn cước công dân (ký hiệu là CC01);\nTải về\n\nKết quả thực hiện:\nThẻ căn cước",
  "source": {
    "source_id": "bca-portal#1.000889",
    "url": "https://dichvucong.bocongan.gov.vn/bocongan/bothutuc/tthc?matt=26099",
    "locator": null,
    "title": "Cấp đổi thẻ căn cước (thực hiện tại cấp trung ương) — Cổng Dịch vụ công Bộ Công an",
    "retrieved_at": "2026-10-10",
    "effective_date": null,
    "content_hash": "sha256:2369816eb7646fe7a961dfcf489e25de191bffe2134dc19330f1ba64a5133b16"
  }
}
